{
  "name": "@prxy-official/exact-cache",
  "displayName": "Exact Cache",
  "version": "1.0.0",
  "description": "Returns cached responses for byte-identical requests. Hash-keyed by a stable serialization of the canonical request — fastest cache type with zero false positives.",
  "author": {
    "name": "ekkOS Technologies Inc.",
    "github": "Ekkos-Technologies-Inc",
    "email": "hello@ekkos.dev"
  },
  "license": "MIT",
  "category": "cache",
  "tags": ["cache", "hash", "deterministic", "latency"],
  "supports": { "cloud": true, "local": true },
  "configSchema": "https://github.com/Ekkos-Technologies-Inc/prxy-monster/blob/main/packages/modules-core/src/exact-cache.ts",
  "documentation": "https://docs.prxy.monster/modules/exact-cache",
  "repository": "https://github.com/Ekkos-Technologies-Inc/prxy-monster",
  "npm": null,
  "submittedAt": "2026-04-27T00:00:00Z",
  "verified": true,
  "verifiedAt": "2026-04-27T00:00:00Z",
  "stats": { "downloads30d": 0, "successRate": null },
  "dependencies": { "@prxy/module-sdk": "^1.0.0" },
  "kind": "free"
}
