{
  "name": "@prxy-official/router",
  "displayName": "Router",
  "version": "1.0.0",
  "description": "Picks the best model for each request. Strategies: cheapest-first, fallback chain, or q-learning based on per-query historical success rate.",
  "author": {
    "name": "ekkOS Technologies Inc.",
    "github": "Ekkos-Technologies-Inc",
    "email": "hello@ekkos.dev"
  },
  "license": "MIT",
  "category": "routing",
  "tags": [
    "routing",
    "model-selection",
    "cost-optimization",
    "q-learning"
  ],
  "supports": {
    "cloud": true,
    "local": true
  },
  "configSchema": "https://docs.prxy.monster/modules/router#configuration",
  "documentation": "https://docs.prxy.monster/modules/router",
  "repository": "https://github.com/Ekkos-Technologies-Inc/prxy-monster-local",
  "npm": null,
  "submittedAt": "2026-04-27T00:00:00Z",
  "verified": true,
  "verifiedAt": "2026-04-27T00:00:00Z",
  "stats": {
    "downloads30d": 0,
    "successRate": null
  },
  "dependencies": {
    "@prxy/module-sdk": "^1.0.0"
  },
  "kind": "free"
}
