{
  "name": "@prxy-official/cost-guard",
  "displayName": "Cost Guard",
  "version": "1.0.0",
  "description": "Per-request, per-day, and per-month USD budget enforcement. Short-circuits requests that would breach a configured limit with a 429-shaped response.",
  "author": {
    "name": "ekkOS Technologies Inc.",
    "github": "Ekkos-Technologies-Inc",
    "email": "hello@ekkos.dev"
  },
  "license": "MIT",
  "category": "safety",
  "tags": [
    "budget",
    "cost",
    "limits",
    "rate-limit"
  ],
  "supports": {
    "cloud": true,
    "local": true
  },
  "configSchema": "https://docs.prxy.monster/modules/cost-guard#configuration",
  "documentation": "https://docs.prxy.monster/modules/cost-guard",
  "repository": "https://github.com/Ekkos-Technologies-Inc/prxy-monster-local",
  "npm": null,
  "submittedAt": "2026-04-27T00:00:00Z",
  "verified": true,
  "verifiedAt": "2026-04-27T00:00:00Z",
  "stats": {
    "downloads30d": 0,
    "successRate": null
  },
  "dependencies": {
    "@prxy/module-sdk": "^1.0.0"
  },
  "kind": "free"
}
