{
  "name": "@prxy-official/tool-cache",
  "displayName": "Tool Cache",
  "version": "1.0.0",
  "description": "Observes (and in v2 will cache) MCP tool-call results. Records tool_use → tool_result pairs and stamps observability metadata for repeated calls. Excludes side-effecting tools by default.",
  "author": {
    "name": "ekkOS Technologies Inc.",
    "github": "Ekkos-Technologies-Inc",
    "email": "hello@ekkos.dev"
  },
  "license": "MIT",
  "category": "cache",
  "tags": [
    "mcp",
    "tools",
    "cache",
    "observability"
  ],
  "supports": {
    "cloud": true,
    "local": true
  },
  "configSchema": "https://docs.prxy.monster/modules/tool-cache#configuration",
  "documentation": "https://docs.prxy.monster/modules/tool-cache",
  "repository": "https://github.com/Ekkos-Technologies-Inc/prxy-monster-local",
  "npm": null,
  "submittedAt": "2026-04-27T00:00:00Z",
  "verified": true,
  "verifiedAt": "2026-04-27T00:00:00Z",
  "stats": {
    "downloads30d": 0,
    "successRate": null
  },
  "dependencies": {
    "@prxy/module-sdk": "^1.0.0"
  },
  "kind": "free"
}
