{
  "name": "@prxy-official/guardrails",
  "displayName": "Guardrails",
  "version": "1.0.0",
  "description": "Content filtering at the gateway layer. PII redaction (email, SSN, credit-card), profanity blocking, and user-supplied regex patterns. v2 adds NIM and Anthropic Constitutional backends.",
  "author": {
    "name": "ekkOS Technologies Inc.",
    "github": "Ekkos-Technologies-Inc",
    "email": "hello@ekkos.dev"
  },
  "license": "MIT",
  "category": "safety",
  "tags": ["pii", "redaction", "content-filter", "compliance"],
  "supports": { "cloud": true, "local": true },
  "configSchema": "https://github.com/Ekkos-Technologies-Inc/prxy-monster/blob/main/packages/modules-core/src/guardrails.ts",
  "documentation": "https://docs.prxy.monster/modules/guardrails",
  "repository": "https://github.com/Ekkos-Technologies-Inc/prxy-monster",
  "npm": null,
  "submittedAt": "2026-04-27T00:00:00Z",
  "verified": true,
  "verifiedAt": "2026-04-27T00:00:00Z",
  "stats": { "downloads30d": 0, "successRate": null },
  "dependencies": { "@prxy/module-sdk": "^1.0.0" },
  "kind": "free"
}
