{
  "name": "@prxy-official/mcp-optimizer",
  "displayName": "MCP Optimizer",
  "version": "1.0.0",
  "description": "Prunes MCP tools to the ones actually relevant to the user's last message. Solves the 67k-tokens-of-MCP-tools problem by scoring each tool against the request via embeddings.",
  "author": {
    "name": "ekkOS Technologies Inc.",
    "github": "Ekkos-Technologies-Inc",
    "email": "hello@ekkos.dev"
  },
  "license": "MIT",
  "category": "optimization",
  "tags": [
    "mcp",
    "tools",
    "token-reduction",
    "embeddings"
  ],
  "supports": {
    "cloud": true,
    "local": true
  },
  "configSchema": "https://docs.prxy.monster/modules/mcp-optimizer#configuration",
  "documentation": "https://docs.prxy.monster/modules/mcp-optimizer",
  "repository": "https://github.com/Ekkos-Technologies-Inc/prxy-monster-local",
  "npm": null,
  "submittedAt": "2026-04-27T00:00:00Z",
  "verified": true,
  "verifiedAt": "2026-04-27T00:00:00Z",
  "featured": true,
  "stats": {
    "downloads30d": 0,
    "successRate": null
  },
  "dependencies": {
    "@prxy/module-sdk": "^1.0.0"
  },
  "kind": "free"
}
