{
  "name": "@prxy-official/ipc",
  "displayName": "IPC — Inter-Prompt Compression",
  "version": "1.0.0",
  "description": "Compresses older messages instead of dropping them when a request exceeds the context window utilization target. Keeps long conversations going past context limits.",
  "author": {
    "name": "ekkOS Technologies Inc.",
    "github": "Ekkos-Technologies-Inc",
    "email": "hello@ekkos.dev"
  },
  "license": "MIT",
  "category": "context",
  "tags": [
    "compression",
    "context-window",
    "long-conversations",
    "summarization"
  ],
  "supports": {
    "cloud": true,
    "local": true
  },
  "configSchema": "https://docs.prxy.monster/modules/ipc#configuration",
  "documentation": "https://docs.prxy.monster/modules/ipc",
  "repository": "https://github.com/Ekkos-Technologies-Inc/prxy-monster-local",
  "npm": null,
  "submittedAt": "2026-04-27T00:00:00Z",
  "verified": true,
  "verifiedAt": "2026-04-27T00:00:00Z",
  "featured": true,
  "stats": {
    "downloads30d": 0,
    "successRate": null
  },
  "dependencies": {
    "@prxy/module-sdk": "^1.0.0"
  },
  "kind": "free"
}
