{
  "name": "@prxy-official/prompt-optimizer",
  "displayName": "Prompt Optimizer",
  "version": "1.0.0",
  "description": "Restructures requests to maximize Anthropic prompt-cache hits. Sorts tools deterministically and stamps cache-control markers on the longest stable prefix.",
  "author": {
    "name": "ekkOS Technologies Inc.",
    "github": "Ekkos-Technologies-Inc",
    "email": "hello@ekkos.dev"
  },
  "license": "MIT",
  "category": "optimization",
  "tags": [
    "prompt-cache",
    "anthropic",
    "cache-control",
    "token-reduction"
  ],
  "supports": {
    "cloud": true,
    "local": true
  },
  "configSchema": "https://docs.prxy.monster/modules/prompt-optimizer#configuration",
  "documentation": "https://docs.prxy.monster/modules/prompt-optimizer",
  "repository": "https://github.com/Ekkos-Technologies-Inc/prxy-monster-local",
  "npm": null,
  "submittedAt": "2026-04-27T00:00:00Z",
  "verified": true,
  "verifiedAt": "2026-04-27T00:00:00Z",
  "stats": {
    "downloads30d": 0,
    "successRate": null
  },
  "dependencies": {
    "@prxy/module-sdk": "^1.0.0"
  },
  "kind": "free"
}
